<?xml version="1.0" encoding="UTF-8"?>
<?xml-stylesheet href="file.css" type="text/css"?>
<persona xmlns:xsi="http://www.w3.org/2001/XMLSchema-instance" xsi:noNamespaceSchemaLocation="./ejemplo1.xsd">
    <nombre>Pedro</nombre>
    <apellidos>Ortiz Pérez</apellidos>
    <fecha_nacimiento>
        <dia>15</dia>
        <mes>04</mes>
        <año>2001</año>
        <diaSemana>Lunes</diaSemana>
    </fecha_nacimiento>
    <direccion>
        <calle>Principal</calle>
        <cp>41000</cp>
    </direccion>
    <dni>00000000T</dni>
    <edad nacionalidad="E">55</edad>
</persona>